{
  "category": "systems",
  "criteria": "Elements, elemental reactions, Visions, Delusions and other power systems, physics, and gameplay mechanics (labelled).",
  "cutoff": "7.1",
  "notes": "Generated from the discovery research pass on 2026-10-11 and maintained by hand afterwards. Status is computed by tools/check_coverage.py --sync.",
  "items": [
    {
      "id": "system.roleplay-physics",
      "name": "Physical laws and roleplay physics",
      "entity_type": "system",
      "status": "complete",
      "priority": "critical",
      "subdir": "physics",
      "nation": null,
      "introduced_in": "1.0",
      "wiki": null,
      "notes": "Project guidance (lore_status mixed/roleplay_adaptation): ordinary biology and survival, ageing and lifespans, food/sleep/exhaustion, travel and communication, medicine and healing, injury and recovery, death, weather hazards, elemental damage, water/drowning/pressure, explosions and structural damage, magic limits, teleportation, dimensional boundaries, resurrection - grounded in canon examples, clearly separating canon from recommended interpretation.",
      "group": "manual"
    },
    {
      "id": "system.anemo",
      "name": "Anemo",
      "entity_type": "system",
      "status": "complete",
      "priority": "critical",
      "subdir": "elements",
      "nation": "location.mondstadt",
      "introduced_in": "1.0",
      "wiki": "Anemo",
      "notes": "Element of wind; Archon Barbatos (Mondstadt).",
      "group": "systems-creatures"
    },
    {
      "id": "system.cryo",
      "name": "Cryo",
      "entity_type": "system",
      "status": "complete",
      "priority": "critical",
      "subdir": "elements",
      "nation": "location.snezhnaya",
      "introduced_in": "1.0",
      "wiki": "Cryo",
      "notes": "Element of ice; the wiki currently names the associated Archon as Vassaga (Snezhnaya). Check this against the 7.x story.",
      "group": "systems-creatures"
    },
    {
      "id": "system.delusion",
      "name": "Delusion",
      "entity_type": "system",
      "status": "complete",
      "priority": "critical",
      "subdir": "delusions",
      "nation": "location.snezhnaya",
      "introduced_in": null,
      "wiki": "Delusion",
      "notes": "Fatui-made Vision-like devices, thought to use divine remains, that harm the user. | merged term.delusion: Fatui artificial Vision analogues that drain life; glossary pointer to system.delusions.",
      "group": "systems-creatures"
    },
    {
      "id": "system.dendro",
      "name": "Dendro",
      "entity_type": "system",
      "status": "complete",
      "priority": "critical",
      "subdir": "elements",
      "nation": "location.sumeru",
      "introduced_in": "1.0",
      "wiki": "Dendro",
      "notes": "Element of plants; Archon Buer (Sumeru). Playable from 3.0.",
      "group": "systems-creatures"
    },
    {
      "id": "system.electro",
      "name": "Electro",
      "entity_type": "system",
      "status": "complete",
      "priority": "critical",
      "subdir": "elements",
      "nation": "location.inazuma",
      "introduced_in": "1.0",
      "wiki": "Electro",
      "notes": "Element of lightning; Archon Beelzebul (Inazuma).",
      "group": "systems-creatures"
    },
    {
      "id": "system.elemental-reaction",
      "name": "Elemental Reaction",
      "entity_type": "system",
      "status": "complete",
      "priority": "critical",
      "subdir": "elemental-reactions",
      "nation": null,
      "introduced_in": "1.0",
      "wiki": "Elemental Reaction",
      "notes": "Hub page: aura and trigger table; transformative vs amplifying reactions; Lunar and Stellar Glimmer subsets.",
      "group": "systems-creatures"
    },
    {
      "id": "system.elements",
      "name": "Element",
      "entity_type": "system",
      "status": "complete",
      "priority": "critical",
      "subdir": "elements",
      "nation": null,
      "introduced_in": "1.0",
      "wiki": "Element",
      "notes": "Overview of the seven Elements, their Archons and the elemental system. Hub entry.",
      "group": "systems-creatures"
    },
    {
      "id": "system.geo",
      "name": "Geo",
      "entity_type": "system",
      "status": "complete",
      "priority": "critical",
      "subdir": "elements",
      "nation": "location.liyue",
      "introduced_in": "1.0",
      "wiki": "Geo",
      "notes": "Element of earth; Archon Morax (Liyue).",
      "group": "systems-creatures"
    },
    {
      "id": "system.hydro",
      "name": "Hydro",
      "entity_type": "system",
      "status": "complete",
      "priority": "critical",
      "subdir": "elements",
      "nation": "location.fontaine",
      "introduced_in": "1.0",
      "wiki": "Hydro",
      "notes": "Element of water; Archon was Focalors (Fontaine). Wiki now uses past tense for the Hydro Archon.",
      "group": "systems-creatures"
    },
    {
      "id": "system.nightsoul",
      "name": "Nightsoul's Blessing",
      "entity_type": "system",
      "status": "complete",
      "priority": "critical",
      "subdir": "powers",
      "nation": "location.natlan",
      "introduced_in": "5.0",
      "wiki": "Nightsoul's Blessing",
      "notes": "Natlan power state, including Nightsoul Burst. Tied to the Night Kingdom and the Wayob, and to Ancient Name bearers.",
      "group": "systems-creatures"
    },
    {
      "id": "system.pyro",
      "name": "Pyro",
      "entity_type": "system",
      "status": "complete",
      "priority": "critical",
      "subdir": "elements",
      "nation": "location.natlan",
      "introduced_in": "1.0",
      "wiki": "Pyro",
      "notes": "Element of fire; wiki names the associated Archon as Haborym (Natlan).",
      "group": "systems-creatures"
    },
    {
      "id": "system.vision",
      "name": "Vision",
      "entity_type": "system",
      "status": "complete",
      "priority": "critical",
      "subdir": "visions",
      "nation": null,
      "introduced_in": "1.0",
      "wiki": "Vision",
      "notes": "Gods' eyes granted to allogenes, people with strong desires who may ascend to Celestia. Also covers the term 'allogenes'. | merged term.vision: Glossary pointer; the system entry (system.visions) holds mechanics.",
      "group": "systems-creatures"
    },
    {
      "id": "system.alchemy",
      "name": "Alchemy",
      "entity_type": "system",
      "status": "drafted",
      "priority": "high",
      "subdir": "powers",
      "nation": null,
      "introduced_in": "1.0",
      "wiki": "Mystic Arts in Teyvat",
      "notes": "Alchemy in lore: Mondstadt, Sumeru and Snezhnayan bio-alchemy (Koshchei, Hvergelmir, Aberrant Chimeric Monsters). The 'Alchemy' wiki page is the crafting mechanic.",
      "group": "systems-creatures"
    },
    {
      "id": "system.arkhe",
      "name": "Arkhe",
      "entity_type": "system",
      "status": "drafted",
      "priority": "high",
      "subdir": "powers",
      "nation": "location.fontaine",
      "introduced_in": "4.0",
      "wiki": "Arkhe",
      "notes": "Opposing Pneuma and Ousia energies (Annihilation). Covers both Pneuma and Ousia, which redirect here.",
      "group": "systems-creatures"
    },
    {
      "id": "system.art-of-khemia",
      "name": "Art of Khemia",
      "entity_type": "system",
      "status": "drafted",
      "priority": "high",
      "subdir": "powers",
      "nation": "location.khaenriah",
      "introduced_in": null,
      "wiki": "Art of Khemia",
      "notes": "Khaenri'ahn life-creating alchemy (Rhinedottir, Albedo, Durin). | Khaenri'ahn alchemy focused on creating life (Rhinedottir, Albedo, Durin). | merged lore.art-of-khemia: Khaenri'ahn life-creating alchemy (Rhinedottir, Albedo); major factor in the Cataclysm.",
      "group": "npc-cosmic-abyss"
    },
    {
      "id": "system.constellations",
      "name": "Constellation",
      "entity_type": "system",
      "status": "drafted",
      "priority": "high",
      "subdir": "gameplay",
      "nation": null,
      "introduced_in": "1.0",
      "wiki": "Constellation",
      "notes": "Both a lore concept (each person's star fate) and a gameplay upgrade.",
      "group": "systems-creatures"
    },
    {
      "id": "system.eitr",
      "name": "Eitr",
      "entity_type": "system",
      "status": "drafted",
      "priority": "high",
      "subdir": "powers",
      "nation": "location.snezhnaya",
      "introduced_in": null,
      "wiki": "Eitr",
      "notes": "Embryonic-Ichoric-Telluric-Rudiment: a Hyperborean creation that holds Light Realm power and is used to alter organisms. | merged item.eitr: Embryonic-Ichoric-Telluric-Rudiment; Hyperborean Light-Realm life-altering creation; Ronova fused it with a Nail in 7.1. Introduced 7.x - exact version unverified.",
      "group": "systems-creatures"
    },
    {
      "id": "system.immortality",
      "name": "Immortality and Resurrection",
      "entity_type": "system",
      "status": "drafted",
      "priority": "high",
      "subdir": "physics",
      "nation": null,
      "introduced_in": null,
      "wiki": null,
      "notes": "Synthesis entry (no single wiki page): Khaenri'ahn curse of immortality, adeptal longevity, zombies (Qiqi), Natlan's Ode of Resurrection, Ronova and the cycle of life and death. Sources: Ode of Resurrection, Zombie, Erosion, Khaenri'ah/History.",
      "group": "systems-creatures"
    },
    {
      "id": "system.kresnik-kristall",
      "name": "Kresnik Kristall",
      "entity_type": "system",
      "status": "drafted",
      "priority": "high",
      "subdir": "powers",
      "nation": "location.snezhnaya",
      "introduced_in": "7.0",
      "wiki": "Kresnik's Torch",
      "notes": "Snezhnaya's heat-energy source: Kresnik's Torch is an artificial heat source fueled by Kresnik Kristall ore. A separate 'Kresnik Kristall' page exists for the exploration ore. | merged item.kresnik-kristall: Snezhnaya energy ore (Kresnik Energy for the Eye of Graeae).",
      "group": "systems-creatures"
    },